{
  "$schema": "https://json-schema.org/draft/2020-12/schema",
  "$id": "https://wefter.dev/schemas/workflow-manifest.schema.json",
  "type": "object",
  "required": ["id", "status", "title", "summary", "commands"],
  "properties": {
    "id": { "type": "string", "pattern": "^[a-z0-9][a-z0-9-]*$" },
    "status": { "enum": ["available", "planned"] },
    "title": { "type": "string", "minLength": 1 },
    "summary": { "type": "string", "minLength": 1 },
    "commands": {
      "type": "object",
      "required": ["cli", "opencode"],
      "properties": {
        "cli": { "type": "array", "items": { "type": "string", "minLength": 1 } },
        "opencode": { "type": "array", "items": { "type": "string", "minLength": 1 } }
      },
      "additionalProperties": false
    },
    "plannedCommands": {
      "type": "object",
      "required": ["cli", "opencode"],
      "properties": {
        "cli": { "type": "array", "items": { "type": "string", "minLength": 1 } },
        "opencode": { "type": "array", "items": { "type": "string", "minLength": 1 } }
      },
      "additionalProperties": false
    }
  },
  "additionalProperties": true
}
